{
  "version": 1,
  "updatedAt": "2026-02-18T11:34:39.909Z",
  "updatedBy": "system",
  "inquiry": {
    "endpoint": "https://formsubmit.co/ajax/info@bobg.xyz",
    "recipient": "info@bobg.xyz"
  },
  "heroMetricsByLocale": {
    "ja": [
      {
        "value": "12",
        "label": "トークン発行数"
      },
      {
        "value": "22",
        "label": "トークン上場数"
      }
    ],
    "en": [
      {
        "value": "12",
        "label": "Token Issued"
      },
      {
        "value": "22",
        "label": "Token Listings"
      }
    ]
  },
  "materialModalTextByLocale": {
    "ja": {
      "lead": "ご登録いただいたメールアドレスに資料をお送りいたします。",
      "labelName": "お名前",
      "labelMail": "メールアドレス",
      "labelCompany": "会社名",
      "placeholderName": "山田 太郎",
      "placeholderMail": "○○○@hello.japan",
      "placeholderCompany": "株式会社 Hello japan",
      "submit": "資料請求する"
    },
    "en": {
      "lead": "The materials will be sent to your email address.",
      "labelName": "Your Name",
      "labelMail": "E-mail Address",
      "labelCompany": "Company",
      "placeholderName": "Taro Yamada",
      "placeholderMail": "○○○@hello.japan",
      "placeholderCompany": "Hello japan Inc.",
      "submit": "Request for Materials"
    }
  },
  "inquiryCopyByLocale": {
    "ja": {
      "contactSuccess": "お問い合わせを受け付けました。担当者よりご連絡いたします。",
      "materialSuccess": "資料請求を受け付けました。ご登録のメールアドレスをご確認ください。",
      "sendError": "送信に失敗しました。時間をおいて再度お試しください。"
    },
    "en": {
      "contactSuccess": "Your inquiry has been sent. Our team will contact you shortly.",
      "materialSuccess": "Your material request has been sent. Please check your mailbox.",
      "sendError": "Failed to send. Please try again in a few minutes."
    }
  },
  "locales": {
    "ja": {
      "texts": [
        "BOBG PTE. LTD. 読み込まれました",
        "協業プロジェクト",
        "ニュース",
        "サービス",
        "メンバー",
        "お問い合わせ",
        "EN",
        "/",
        "JA",
        "企業のトークン発行を、もっと簡単に。",
        "企業のトークン発行・管理・運用から",
        "暗号資産取引所への上場までを一気通貫でサポート",
        "協業プロジェクト",
        "株式会社エイチームエンターテインメント",
        "CryptoGames株式会社",
        "株式会社ドリコム / チューリンガム株式会社",
        "double jump.tokyo株式会社 / 株式会社セガ",
        "double jump.tokyo株式会社",
        "extra mile株式会社（株式会社テレビ朝日ミュージック子会社） / CryptoGames株式会社",
        "株式会社GALLUSYS / チューリンガム株式会社",
        "株式会社gumi",
        "Highphen Pte. Ltd.",
        "株式会社Kyuzan / 株式会社セガ",
        "MCH株式会社",
        "株式会社YOAKE entertainment",
        "上場実績（一部）",
        "ニュース",
        "2025/10/29",
        "トークン発行支援のBOBG社、Kyuzan社と『甲虫王者ムシキング』IP活用のブロックチェーンゲーム『MUSHInomics with MUSHIKING』で協業",
        "2025/03/13",
        "BOBG社、Soneiumと連携",
        "2025/03/10",
        "トークン発行支援のBOBG社、CryptoGames社が運営する日本発のIPを活用したWeb3コンテンツを展開する分散型IPプラットフォーム「Xross Road」で協業",
        "View all",
        "サービス",
        "トークンの発行・管理・運用",
        "プロジェクトのスケジュールに合わせた柔軟なトークンの発行体制を構築。高いセキュリティや適切なガバナンス体制でトークンの安全な管理・運用を実現。",
        "暗号資産取引所上場・流動性提供支援",
        "CEX (暗号資産取引所)やDEX (分散型取引所) への上場、流動性提供をサポートし、ローンチ時点からグローバル市場への展開が可能。",
        "バックオフィス体制構築支援",
        "プロジェクトに合わせたスキームを構築し、トークン発行におけるバックオフィス・コーポレートの諸問題を最小化。プロジェクトの価値創出に集中できるよう支援。",
        "コアメンバー",
        "Co-CEO",
        "Kengo Masuyama",
        "Co-CEO",
        "Hirokazu Kimizuka",
        "Sales Lead",
        "Akira Ishida",
        "Project Manager",
        "Sorato Hino",
        "Head of Tech",
        "Kazuya Fujimoto",
        "アドバイザー",
        "Haruo Narimoto",
        "弁護士",
        "TMI総合法律事務所",
        "Partner",
        "Jun Meng Heng",
        "弁護士",
        "Entra Law LLC",
        "Managing Director",
        "Kazuaki Mizuchi",
        "公認会計士 / 税理士",
        "水地一彰公認会計士事務所",
        "Naohito Tamaya",
        "Founder of",
        "- double jump.tokyo Inc.",
        "- Oasys Pte. Ltd.",
        "- Arriba Studio Pte. Ltd.",
        "- Animechain LLC",
        "Shun Ishikawa",
        "Startale Labs Pte. Ltd.",
        "Chief of Staff",
        "Astar Foundation COO",
        "Toshihito Wakao",
        "MCH Co.,Ltd CEO",
        "投資家",
        "Arriba Studio Pte. Ltd.",
        "CryptoGames株式会社",
        "double jump.tokyo株式会社",
        "Startale Pte. Ltd.",
        "パートナー",
        "お問い合わせ",
        "会社名",
        "*",
        "お名前",
        "*",
        "メールアドレス",
        "*",
        "お問い合わせ内容",
        "*",
        "送信",
        "description",
        "資料請求はこちら"
      ],
      "images": [
        "https://storage.googleapis.com/studio-design-asset-files/projects/p6aonn3NqR/s-1920x1080_v-frms_webp_45443e5f-fe88-48a1-b9ad-ca02c4dfba11_middle.webp",
        "https://storage.googleapis.com/studio-design-asset-files/projects/p6aonn3NqR/s-1200x675_v-fms_webp_9fb9ccdf-84d1-447f-a08f-fbb4247a6d93_small.webp",
        "https://storage.googleapis.com/studio-design-asset-files/projects/rROnkMy2qA/s-1980x1080_v-frms_webp_eb6b2724-dd81-4e42-bd73-57dd41db81ff_small.webp",
        "https://storage.googleapis.com/studio-design-asset-files/projects/rROnkMy2qA/s-1200x630_v-fms_webp_5a61ac18-f57a-4f4c-ac98-bad65534c379_small.webp",
        "https://storage.googleapis.com/studio-design-asset-files/projects/p6aonn3NqR/s-1950x988_053403bc-d833-4ef0-9ec8-983db3912e80.webp",
        "https://storage.googleapis.com/studio-design-asset-files/projects/rROnkMy2qA/s-916x480_v-fs_webp_503ab6a8-c570-4bc0-8690-a3e93e176b7e_small.webp",
        "https://storage.googleapis.com/studio-design-asset-files/projects/p6aonn3NqR/s-1920x1080_v-frms_webp_724fb12c-05ce-4f30-8a43-e4d9810962df_small.webp",
        "https://storage.googleapis.com/studio-design-asset-files/projects/rROnkMy2qA/s-1200x630_4ef37e6b-bec4-418f-a935-94c650093308.webp",
        "https://storage.googleapis.com/studio-design-asset-files/projects/rROnkMy2qA/s-1200x675_v-fms_webp_8977760f-82c8-4d5d-839c-2b30352d10b7_small.webp",
        "https://storage.googleapis.com/studio-design-asset-files/projects/rROnkMy2qA/s-1920x1080_72677222-2ebc-425a-8c2f-e53bfb90d500.webp",
        "https://storage.googleapis.com/studio-design-asset-files/projects/p6aonn3NqR/s-1200x675_v-fms_webp_480c7cfe-01fc-413c-92d7-b83b4a31ca4e_small.webp",
        "https://storage.googleapis.com/studio-design-asset-files/projects/rROnkMy2qA/s-1200x630_v-fms_webp_c86264d4-3686-474d-af5b-5454be4d57a1_small.webp",
        "https://storage.googleapis.com/studio-design-asset-files/projects/p6aonn3NqR/s-1920x1080_v-frms_webp_ab50e0e2-fde3-4888-b7da-98b00dae621b_small.webp",
        "https://storage.googleapis.com/studio-design-asset-files/projects/p6aonn3NqR/s-1920x700_v-frms_webp_f6c77d4e-6e8e-4f85-8816-6e58e2bbc339_small.webp",
        "https://storage.googleapis.com/studio-design-asset-files/projects/p6aonn3NqR/s-1920x700_v-frms_webp_6a22aa31-614e-43d8-8b84-8adfe4df7524_small.webp",
        "https://storage.googleapis.com/studio-design-asset-files/projects/p6aonn3NqR/s-1920x700_v-frms_webp_266ab0d2-5380-4024-8c7e-f601431ec4c3_small.webp",
        "https://storage.googleapis.com/studio-design-asset-files/projects/p6aonn3NqR/s-1920x700_v-frms_webp_2f1ca0a5-c740-4dda-8647-948c30c54d9a_small.webp",
        "https://storage.googleapis.com/studio-design-asset-files/projects/p6aonn3NqR/s-1920x700_v-frms_webp_d4068190-3966-455f-9cfb-058af0b660f7_small.webp",
        "https://storage.googleapis.com/studio-design-asset-files/projects/p6aonn3NqR/s-1920x700_v-frms_webp_13474bee-5e3a-4acd-84c1-0ac39b7cfa85_small.webp",
        "https://storage.googleapis.com/studio-design-asset-files/projects/p6aonn3NqR/s-1920x700_v-frms_webp_3a9307c9-a225-4555-bc52-e71420582a3d_small.webp",
        "https://storage.googleapis.com/studio-design-asset-files/projects/p6aonn3NqR/s-1920x700_v-frms_webp_9ab67e68-7882-4dd1-89ae-b1fe88025086_small.webp",
        "https://images.unsplash.com/photo-1666811722581-7900271596c0?crop=entropy&cs=tinysrgb&fit=max&fm=jpg&ixid=M3w2MzQ2fDB8MXxzZWFyY2h8NDZ8fEJsb2NrY2hhaW4lMjBXYWxsZXR8ZW58MHx8fHwxNzIyOTM4MzgyfDA&ixlib=rb-4.0.3&q=80&w=1080",
        "https://images.unsplash.com/photo-1639389016105-2fb11199fb6b?crop=entropy&cs=tinysrgb&fit=max&fm=jpg&ixid=M3w2MzQ2fDB8MXxzZWFyY2h8Nnx8Q3J5cHRvJTIwZXhjaGFuZ2V8ZW58MHx8fHwxNzMxMDU5MjgxfDA&ixlib=rb-4.0.3&q=80&w=1080",
        "https://images.unsplash.com/photo-1637478441663-067ba251a079?crop=entropy&cs=tinysrgb&fit=max&fm=jpg&ixid=M3w2MzQ2fDB8MXxzZWFyY2h8Mjl8fHNreSUyMHNjcmFwZXJ8ZW58MHx8fHwxNzIyOTM5MjA1fDA&ixlib=rb-4.0.3&q=80&w=1080",
        "https://storage.googleapis.com/studio-design-asset-files/projects/p6aonn3NqR/s-600x300_v-fs_webp_ce147d21-aa51-4d1c-8b94-919070d8078d_small.webp",
        "https://storage.googleapis.com/studio-design-asset-files/projects/rROnkMy2qA/s-338x172_0c7ccc96-08dd-4bf6-8b5f-7fcc528ff289.webp",
        "https://storage.googleapis.com/studio-design-asset-files/projects/rROnkMy2qA/s-338x172_6290cda0-a5e3-47fc-beab-3f88d4f2cb17.webp",
        "https://storage.googleapis.com/studio-design-asset-files/projects/rROnkMy2qA/s-1200x630_v-fms_webp_cd73d1c3-ec4e-45ce-b346-93b2f31acfe4_small.webp",
        "https://storage.googleapis.com/studio-design-asset-files/projects/p6aonn3NqR/s-300x150_webp_af283a28-b23d-465b-89e7-9d31140e3f6f.webp",
        "https://storage.googleapis.com/studio-design-asset-files/projects/p6aonn3NqR/s-600x298_v-fs_webp_720de6c6-7bae-486f-ad99-c43f0e7f4af0_small.webp",
        "https://storage.googleapis.com/studio-design-asset-files/projects/p6aonn3NqR/s-600x300_v-fs_webp_88e4fd63-d6fa-45c9-8d03-b43c337a006b_small.webp",
        "https://storage.googleapis.com/studio-design-asset-files/projects/p6aonn3NqR/s-598x294_webp_c02650a3-c7f9-4d07-9f65-59d1976a8d55.webp",
        "https://storage.googleapis.com/studio-design-asset-files/projects/p6aonn3NqR/s-598x294_webp_5ac13e7b-5af5-4ac4-93c4-451ae7aff41c.webp",
        "https://storage.googleapis.com/studio-design-asset-files/projects/p6aonn3NqR/s-600x300_v-fs_webp_bc56637a-70f2-44c5-96d5-08d7f819a6ff_small.webp",